{
  "schema": "mindgarden.migration/v1",
  "id": "migration-v0-v1",
  "garden": "example-garden",
  "from_contract": "mindgarden.note/v0",
  "to_contract": "mindgarden.knowledge/v1",
  "status": "planned",
  "plan_sha256": "aaaaaaaaaaaaaaaaaaaaaaaaaaaaaaaaaaaaaaaaaaaaaaaaaaaaaaaaaaaaaaaa",
  "created_at": "2026-08-28T00:00:00Z",
  "applied_at": null,
  "preserved_ids": [
    "example-home",
    "repository-architecture"
  ],
  "mappings": [
    {
      "kind": "preserve",
      "from": [
        {
          "garden": "example-garden",
          "id": "repository-architecture",
          "revision": "version:1.0.0"
        }
      ],
      "to": [
        {
          "garden": "example-garden",
          "id": "repository-architecture",
          "revision": null
        }
      ],
      "reason": "Stable identifiers survive the additive migration."
    }
  ],
  "provenance": {
    "garden": "example-garden",
    "id": "provenance-migration-v0-v1",
    "revision": null
  }
}
